Category,Disease,Prevention_Tip
Dermatology,Scarlet fever,Prompt treatment of strep throat; good hygiene.
Dermatology,Shingles,Vaccination (for older adults).
Dermatology,Smallpox,Vaccination (historically; disease eradicated).
Dermatology,Stevens-Johnson syndrome,Identify and avoid causative medications if possible (severe drug reaction).
Dermatology,Urticaria,"Identify and avoid triggers (allergens, medications, stress)."
Dermatology,Vitiligo,Prevention unknown; sun protection for affected areas.
Dermatology,Warts,Avoid touching warts; keep feet dry (plantar warts); HPV vaccine may prevent some.
Dermatology,Yaws,Early diagnosis and treatment prevents spread.
Hematology,Anaemia,"Ensure adequate intake of iron, B12, folate (depending on type); treat underlying causes."
Hematology,Haemophilia,Genetic; genetic counseling; avoid injury.
Hematology,Iron Deficiency Anemia,Ensure adequate dietary iron intake; treat blood loss.
Hematology,Leukemia,Avoid high-dose radiation/certain chemicals; prevention mostly unknown.
Hematology,Lymphoma,"Prevent/manage associated infections (HIV, EBV); prevention mostly unknown."
Hematology,Multiple myeloma,Prevention unknown.
Hematology,Sickle-cell anemia,Genetic; genetic counseling; good hydration; avoid triggers.
Hematology,Thalassaemia,Genetic; genetic counseling.
Mental Health and Behavioral Disorders,Alcohol Abuse and Alcoholism,Moderate alcohol consumption or abstinence; seek help early for problem drinking.
Mental Health and Behavioral Disorders,Anxiety,Stress management techniques; healthy lifestyle; seek therapy/support early.
Mental Health and Behavioral Disorders,Autism,Prevention unknown; early intervention is key for management.
Mental Health and Behavioral Disorders,Dementia,Manage cardiovascular risks; stay mentally/physically/socially active.
Mental Health and Behavioral Disorders,Gaming disorder,Set time limits; balance gaming with other activities; be aware of warning signs.
Mental Health and Behavioral Disorders,Insomnia,Good sleep hygiene; manage stress.
Mental Health and Behavioral Disorders,Obsessive Compulsive Disorder,Prevention unknown; stress management; early treatment can help.
Mental Health and Behavioral Disorders,Postpartum depression/ Perinatal depression,Awareness of risk factors; seek support early; screening during/after pregnancy.
Mental Health and Behavioral Disorders,Schizophrenia,Prevention unknown; early intervention improves outcome; avoid substance abuse.
Genetic/Congenital Disorders,Cleft Lip and Cleft Palate,Folic acid supplementation before/during early pregnancy may reduce risk; avoid smoking/alcohol in pregnancy.
Genetic/Congenital Disorders,Congenital anomalies (birth defects),Good prenatal care; folic acid; avoid alcohol/smoking/certain meds during pregnancy; manage maternal conditions.
Genetic/Congenital Disorders,Down's Syndrome,Age-related risk; not preventable otherwise.
Genetic/Congenital Disorders,Haemophilia,Genetic; genetic counseling.
Genetic/Congenital Disorders,Muscular dystrophy,Genetic; genetic counseling.
Genetic/Congenital Disorders,Progeria,Genetic (usually spontaneous mutation); not preventable.
Genetic/Congenital Disorders,Sickle-cell anemia,Genetic; genetic counseling.
Genetic/Congenital Disorders,Tay-Sachs disease,Genetic; carrier screening in high-risk populations; genetic counseling.
Genetic/Congenital Disorders,Thalassaemia,Genetic; genetic counseling; carrier screening.
Genetic/Congenital Disorders,Turners Syndrome,Genetic; not preventable.
Genetic/Congenital Disorders,Warkany syndrome,Genetic; not preventable.
Women's Health/Obstetrics/Gynecology,Antepartum hemorrhage,"Good prenatal care; manage risk factors (e.g., high BP); prompt attention to bleeding."
Women's Health/Obstetrics/Gynecology,Breast Cancer / Carcinoma,Maintain healthy weight; limit alcohol; exercise; screening (mammograms).
Women's Health/Obstetrics/Gynecology,Early pregnancy loss,Manage underlying health conditions; good prenatal care; prevention often not possible.
Women's Health/Obstetrics/Gynecology,Eclampsia,Good prenatal care; early detection and management of preeclampsia.
Women's Health/Obstetrics/Gynecology,Ectopic pregnancy,Prompt treatment of STIs/PID; prevention difficult.
Women's Health/Obstetrics/Gynecology,Endometriosis,Prevention unknown; possibly limiting estrogen exposure (requires medical discussion).
Women's Health/Obstetrics/Gynecology,Fibroids,Prevention unclear; maintain healthy weight.
Women's Health/Obstetrics/Gynecology,High risk pregnancy,Pre-conception counseling; good prenatal care; manage maternal health conditions.
Women's Health/Obstetrics/Gynecology,Mastitis,Proper breastfeeding technique; good hygiene; empty breasts fully.
Women's Health/Obstetrics/Gynecology,Nausea and Vomiting of Pregnancy and Hyperemesis gravidarum,Prevention difficult; small frequent meals; hydration; seek medical help if severe.
Women's Health/Obstetrics/Gynecology,Pelvic inflammatory disease,Practice safe sex; prompt treatment of STIs.
Women's Health/Obstetrics/Gynecology,Polycystic ovary syndrome (PCOS),Prevention unknown; maintain healthy weight.
Women's Health/Obstetrics/Gynecology,Post Menopausal Bleeding,Not preventable; requires prompt medical evaluation to rule out serious causes.
Women's Health/Obstetrics/Gynecology,Postpartum depression/ Perinatal depression,Awareness; seek support early; screening.
Women's Health/Obstetrics/Gynecology,Preeclampsia,Good prenatal care; low-dose aspirin may be recommended for high-risk individuals.
Women's Health/Obstetrics/Gynecology,Premenstrual syndrome,Healthy lifestyle; stress management; track symptoms.
Women's Health/Obstetrics/Gynecology,Preterm birth,Good prenatal care; avoid smoking/alcohol; treat infections; manage chronic conditions.
Women's Health/Obstetrics/Gynecology,Puerperal sepsis,Good hygiene during childbirth; prompt treatment of infections.
Autoimmune Diseases,Celiacs disease,Genetic; not preventable; requires strict gluten-free diet for management.
Autoimmune Diseases,Guillain-Barré syndrome,Prevention unknown; possibly reduce risk by preventing triggering infections.
Autoimmune Diseases,Inflammatory Bowel Disease,Prevention unknown; manage triggers.
Autoimmune Diseases,Lupus erythematosus,Prevention unknown; sun protection is crucial.
Autoimmune Diseases,Multiple sclerosis,Prevention unknown; Vitamin D sufficiency may play a role.
Autoimmune Diseases,Myasthenia gravis,Prevention unknown.
Autoimmune Diseases,Psoriasis,Prevention unknown; manage stress; avoid triggers.
Autoimmune Diseases,Rheumatic fever,Prompt and complete treatment of strep throat infections.
Autoimmune Diseases,Sarcoidosis,Prevention unknown.
Autoimmune Diseases,Vitiligo,Prevention unknown.
Otolaryngology - ENT,Bad Breath (Halitosis),Good oral hygiene; treat underlying cause.
Otolaryngology - ENT,Ear infection,"Vaccination (pneumococcal, flu); avoid smoke exposure; good hygiene."
Otolaryngology - ENT,Laryngitis,Avoid vocal strain; don't smoke.
Otolaryngology - ENT,Mouth Breathing,Treat underlying nasal obstruction.
Otolaryngology - ENT,Nasal Polyps,Manage allergies/asthma; nasal hygiene.
Otolaryngology - ENT,Quinsy,Prompt treatment of tonsillitis/strep throat.
Otolaryngology - ENT,Strep throat,Good hygiene; avoid contact with sick people.
Otolaryngology - ENT,Tinnitus,Protect hearing from loud noise.
Otolaryngology - ENT,Tonsillitis,Good hygiene; avoid contact with sick people.
Environmental/Toxicological Conditions,Asbestos-related diseases,Avoid asbestos exposure.
Environmental/Toxicological Conditions,Burns,Practice fire safety; caution with hot items.
Environmental/Toxicological Conditions,Carbon monoxide poisoning,Install CO detectors; ensure proper ventilation for fuel-burning appliances.
Environmental/Toxicological Conditions,Food Poisoning,"Proper food handling, cooking, storage."
Environmental/Toxicological Conditions,Frost Bite,"Wear appropriate warm, dry clothing; limit cold exposure."
Environmental/Toxicological Conditions,Heat-Related Illnesses and Heat waves,Stay hydrated; avoid strenuous activity in extreme heat; seek cool environments.
Environmental/Toxicological Conditions,Lead poisoning,"Avoid exposure to lead paint/dust, contaminated water/soil."
Other/General/Systemic Conditions/Symptoms,Chronic fatigue syndrome,Prevention unknown; manage stress; pace activities.
Other/General/Systemic Conditions/Symptoms,Cough,Treat underlying cause; avoid irritants; good hygiene.
Other/General/Systemic Conditions/Symptoms,Dehydration,"Drink sufficient fluids, especially during heat, exercise, or illness."
Other/General/Systemic Conditions/Symptoms,Diarrhea,"Prevent infections (hygiene, safe food/water); treat underlying cause."
Other/General/Systemic Conditions/Symptoms,Jaundice,Prevent/treat underlying liver or bile duct condition.
Other/General/Systemic Conditions/Symptoms,Obesity,Maintain healthy diet and regular physical activity.
Other/General/Systemic Conditions/Symptoms,Rheumatism,"Prevent/manage underlying cause (e.g., arthritis)."
Other/General/Systemic Conditions/Symptoms,SIDS,Place infants on back to sleep; use firm sleep surface; avoid soft bedding/overheating; no smoking.
